,Date,Review,Platform
205,2014-10-24,Worst fast food restaurant I have every visited. Doesn't even deserve the one star I am forced to give it.  Paid for 2 meals but only one brought and that was the wrong one.  The assistants grasp of English was so poor it was difficult...More,TripAdvisor
206,2014-10-07,"Me & my family visited this branch on Sat 4 Oct at lunchtime. The queues were long & I waited 40 mins to be served.

When I got served the staff member was new & kept asking for colleagues for help for which buttons to...More",TripAdvisor
207,2014-10-04,"I visited last year and assumed it was a bad day so was happy to try again.  That was a mistake.  The queue was much shorter this time, but food service even slower and less accurate than previously,  while waiting for my own meal, I...More",TripAdvisor
208,2014-09-27,"I truly ever stop at this BK because it was the first spot I found in London that had the fizzy machine to mix up flavor in Coke like Vanilla, Orange, and cherry vanilla.  The only flavor I have yet to see added is coffee....More",TripAdvisor
209,2014-09-12,Traveling along and after going to a show I decided to grab a mean to take back to my room. It was prompt efficient and friendly as one would expect. Was surprised to see two enormous bouncers patrolling the room and doors but I suppose...More,TripAdvisor
210,2014-09-12,The whopper and fries with diet coke is less than 6 pounds. The environment is clean with friendly staffs,TripAdvisor
211,2014-09-02,"No different to any other Burger King around the country. Apart from some rude tourists purposefully putting their rubbish on the table next to them to stop others using it.
Seating is the biggest problem at this location. While sitting down to our food the...More",TripAdvisor
212,2014-08-26,"I'll start by saying the one good thing: the food was good, hot and tasty. Now the bad: the portions of fries were small, the bathroom needed attention, the queue was monstrous and chaotic and overall the experience was poor.",TripAdvisor
213,2014-08-17,Only ate there once  due to very slow service by staff who moved as if in a trance .  A very busy  site  which obviously needs a staff upgrade  to improve this great location on Leicester Square as the burger  was probably the best I...More,TripAdvisor
214,2014-08-13,Appalling staff attitude.  We waited more than 45 mins in a small que to be served the staff in my opinion quite clearly don't want to be there.  Poor lady in front of me spoke very little English and the huffs and puffs of the...More,TripAdvisor
215,2014-07-31,Every time I visit UK Burger King is a must! I like the tasty burgers and the unique potatoes! What else can I say??!!!,TripAdvisor
216,2014-07-27,waited nearly half an hour for fast food which wasn't worth the wait. the place was packed and the staff had no sense of urgency as the sauntered around attempting to fulfil orders. would recommend going to other outlets in an area not so heavily...More,TripAdvisor
217,2014-07-23,"Yes, Burger King is probably the best burger chain for food but the queuing is uncontrolled and chaotic here, the service is disorganised and you will be very lucky to get a seat if you don't want to eat your food standing up. Staff are...More",TripAdvisor
218,2014-07-06,"Fast food. Same as all the others.
Obviously it's very busy, pretty much all of the time. Cheap and cheerful.",TripAdvisor
219,2014-07-03,"Unsatisfactory experience of a visit to London Leicester Square branch on Saturday 28th June 2014 at approximately 10.15pm. My issue does not lie with Burger King as such yet to the security staff. 

As with any service in public, everyone should expect to be treated...More",TripAdvisor
220,2014-07-02,I visited with my brother late last Saturday afternoon. The queue wasn't huge but we waited almost 25 minutes to be served and started to worry that we would miss our train. The person behind the counter seems to have to take the order and...More,TripAdvisor
221,2014-06-15,"Seeing as it is in Central London, it is packed full of people almost 24/7. Me and my Dad went in for a burger but the queue was horrendous, so we used their toilets and travelled to Mcdonalds. Not a complaint against Burger King, just...More",TripAdvisor
222,2014-06-15,For a fast food place. Slowest ever. Rude staff too. Would not visit this burger king again... They really need new  management.,TripAdvisor
223,2014-06-08,"Asked for an Angry whopper, then other food, NOT an Angry whopper meal, Angry whopper is £4.99 yes extortionate in enough itself, but being charged £6.79 is an outrage.",TripAdvisor
224,2014-03-29,"Hello there again people I'm back with another review, I was requested to go here as apparently it's the best food place people have been...
Now let me just tell you this first, it's a good job they have toilets because if they din't I...More",TripAdvisor
225,2014-02-20,Was quite busy but probably less so than I expected. Were able to sit inside easily. Really liked the drinks machines. Staff were very good when taling orders and checked everything was ok when we went back for pudding. Vouchers are accepted here too.,TripAdvisor
226,2014-02-20,"I like BK generally.  Better than that other outfit...

My Aberdeen angus burger was lovely.
Chips were nice - far better than McD.

Complaints:
I thought the chicken strip kids meals were basically nuggets - they are not.  They are also not very nice.  I'm...More",TripAdvisor
227,2014-02-06,"I came here for a late meal. I did have half price vouchers from a newspaper. I ordered cheese burger, tea and reg fries. I was not happy about the reg fries there look so small. I did asked the staff if there were sure...More",TripAdvisor
228,2014-02-04,Tasted fine. Cost was ok. Service always seems really slow and finding a spare seat can be a nightmare.,TripAdvisor
229,2014-01-26,"We went at lunch time so was expecting a queue but it seemed very unorganised more like a croud of people that the staff were just calling forward. 
That being said as always food was amazing! And they had a great selection of drinks I...More",TripAdvisor
230,2014-01-09,"It tastes better in England, but everybody ranging from nuns, vegans and Eskimos, need to have a BACON DOUBLE CHEESBURGER. Look at it this way.
1. There isn't a supersize me about Bk
2. Burger King has attempted to change English with BK instead of...More",TripAdvisor
231,2013-10-25,"Didn't feel safe so walked out. I have eaten there before and it was pleasant enough but on this occasion, there were far too many people crammed in. It was definitely a health and safety issue! It was Chinese New Year and a horrible rainy...More",TripAdvisor
232,2013-10-11,"Fast food,fast service and cheap buy.  Cant really ask for more can we.
sometimes when its big group then the staff seems to loose track of orders but other than that its all good",TripAdvisor
233,2013-09-28,"It had become our favourite joint to give respite to our aching legs after walking, shopping and sightseeing the many attractions of London; and an exercise to our eyes to watch the multinational crowds on the Leicestor Square. And, not to forget the burgers and...More",TripAdvisor
234,2013-09-23,"We have been to this BK several times when in london , the restaurant needs a re-vamp , the upstairs seems dated !! anyway its good value ( as had vouchers) the food is never that hot !!
good view upstairs over leicester sq ....More",TripAdvisor
235,2013-09-18,We found it an interesting place to sit and relax your legs after walking around all the beautiful tourist attractions of London around the Leicestor square. You can watch the revellers from the window while you eat the burgers and all the accompaniments with unlimited...More,TripAdvisor
236,2013-09-18,"If you are ""a bit above"" the ideal BMI, you are asked ""One ???"" at the counter when you order a whopper.
The second floor of the Restaurant is a clean and quiet place to eat and rest from the busy streets of London.",TripAdvisor
237,2013-09-15,We went to Burger King for our breakfast one morning - one poor unhappy guy trying his best to keep customers happy. Big sign up saying it was take away only till 10 am which no one took any notice of and sat at the...More,TripAdvisor
238,2013-09-10,"Very strategically located on the Leicestor Square in London, we went first just to relax and grab some fast food after hours of sight seeing. We got a window seat. Even the vegetarian food was good, with several varieties of soft drinks from self dispensing...More",TripAdvisor
239,2013-09-03,"Good but rammed as was saturday night, rubbish everywhere inside and out. Security guard on the door a bit off putting and drunken misfits everywhere.",TripAdvisor
240,2013-08-14,"This restaurant have bottomless drinks and service is quick and good! Recommend! They have a lot of space and tables. If you like burguer king, this is a good one to visit.",TripAdvisor
241,2013-07-03,"Nothing wrong, but as expected in that location just too busy and therefore the wait is too long there is no where to sit and to many people can't be bothered to carry their trays away.",TripAdvisor
242,2013-06-23,My husband and I just had the worst experience in Burger king Leicester Square. We went to burger king at 1155pm on the 23/6/2013 thinking of getting burger. I was queuing up to buy burgers and my hand was holding a plastic bag with leftover...More,TripAdvisor
243,2013-05-30,Complete and utter garbage...they have not invented adjectives to describe how bad this place is...it is truly awful.,TripAdvisor
244,2013-05-12,Just been insulted in the Burger King on Lester Square in London!!! OUTRAGEOUS experience!!! My boyfriend had some food we bought from a store nearby but I want to get the burgers from Burger King. The staff at the door pushed my boyfriend out when...More,TripAdvisor
245,2013-04-09,"We were hungry, so we went to BK in Leicester Square.The food was horrible and the staff were miserable. IMO MacDonald's is much better.",TripAdvisor
246,2013-04-05,"You know what to expect with BK food, but they have self service drinks machines with a HUGE range of choices -raspberry coke, anyone?- which were great fun!",TripAdvisor
247,2013-03-27,Its my pleasure to write about the food i eat .the staff were friendly and cooperative .i like the service and excellent and warm greeting from the staff .it would be excellent if the manager working there could call their staff and told the things...More,TripAdvisor
248,2013-03-04,"Standard sort of burger king really. You can make changes to a burger if needed eg. I ordered mine without the cheese.
Empty when we went but it was around 11am. 
The best part of it though is the drinks machine. Rather than just standard...More",TripAdvisor
249,2013-02-19,Had to go here to give our son tea as another restaurant in Leicester Square failed to bring his meal.,TripAdvisor
250,2013-02-09,"I was quite looking forward to a Burger King as I hadn't had one for months, and I got what I expected!

The queues were massive and we waited forever for a table, but the food itself was the usual BK fare. I've never seen...More",TripAdvisor
251,2013-01-24,"The service here is terrible, the queues aren't even that big and yet you wait AGES to be served but they have Coca-Cola Freestyle machines and that in itself is worth a visit. Beware of the pigeons though, and the people that stupidly feed them!...More",TripAdvisor
252,2013-01-20,"Good clean restaurant with friendly staff. Food was hot and tasty, plenty of room upstairs to sit, bottomless cup drinks machine, which means you can keep using it until you have had your fill. We also had vouchers to use for so had two meals...More",TripAdvisor
253,2013-01-06,"Burger King is in my opinion, one of the better fast food franchises. It offers a far better tasting and much more filling meal than that of McDonald's and does not leave you feeling like you should visit the doctor immediately after consumption. This particular...More",TripAdvisor
254,2012-12-28,"This restaurant is owned by a friend of mine and I would normally never eat at such a fast food outlet, however, he invited me to meet him there and I was very pleasantly surprised at how much I enjoyed the meal he gave me....More",TripAdvisor
