,Date,Review,Platform
97,2017-04-26,"Ladies toilets here are really rather foul. No paper, floods, empty soap dispensers, one stool without a toilet seat and broken locks.

Service is not that great. A busy Sunday lunchtime and they just closed a till with no notice and made the long line...More",TripAdvisor
98,2017-04-12,"Both burgers were cool, fries were cold and soft drink was warm.
No ice available in both drinks machines upstairs.",TripAdvisor
99,2017-03-26,"Gone there for the first time today,  Arrogant sales man or manager sorry forgot his name he must be from Somalian  background or one of these countries very rude very arogant 

Bought a bottle of water paid £1.89/- as one of my family member was...More",TripAdvisor
100,2017-03-26,Needed to grab a quick bite before movie started. Quick efficient service restaurant clean. Great location.,TripAdvisor
101,2017-03-26,"I used to visit this place every weekend when I lived there for 3 years from 2011-2014! Even though the quality was just ok, the choices ,the prices and I don't know.... that sth that made me visit it very often... make me give it...More",TripAdvisor
102,2017-03-01,"We were in Leicester Square in December and decided to try here. The place was mental busy. So hard to get a seat once you manage to order. The food was nice, hot and tasty. Probably wouldn't be the best place to go with a...More",TripAdvisor
103,2017-01-18,"we were passing through Leicester square when we felt peckish. it was a cold night yet when we went in it was still cold.. we orfered a burger each when they camed tasteless.e o. the seating wasn't very omfortable.
thr one plus I could say.that...More",TripAdvisor
104,2017-01-07,Was here with my young daughter and her friend waiting  outside at the table when the Rudest person I have seen in all of England asked us to never come back here all because we forgot to throw our cups in the bin.We did intend...More,TripAdvisor
105,2017-01-04,I visited the Leicester Square branch in December with my wife and 4 year old child. The restaurant was completely mismanaged with at least 3 more people getting the wrong order or cold food. I ordered a burger and 6 cheese bites for my child....More,TripAdvisor
106,2016-12-23,Came here for lunch on a day out in London I had a chicken royal and so did my sister we were disappointed with this as it had one piece of lettuce in it and was basically just a plain chicken burger also the drinks...More,TripAdvisor
107,2016-12-20,"Hmm. What to say. Lots of food choices in and around Leicester Square. However, having a child we were somewhat dictated by nuggets. Burger King is normally pretty good and we thought as in a tourist area the food should be fresh. We couldn't be...More",TripAdvisor
108,2016-12-16,Just wanted a double cheese burger thought the king deal was £3 and ended up being £5.50. also ridiculously long wait! For a flagship location the service was SLOW then about an hour later i had to run back just to unload had a case...More,TripAdvisor
109,2016-11-22,"Hot food which was served quickly with a smile even at 2am.  It's kept very clean, even the tables are kept wiped down and bins emptied.  Ideal location, open late",TripAdvisor
110,2016-11-16,"5 stars not for the food which we didn't actually have.  No, we give it 5 stars because of the free toilets open for everyone to use.  This is a lifesaver, as central London is a nightmare to find loos",TripAdvisor
111,2016-11-15,"While in the centre of London shopping, we decided to pop into Burger King for something quick to eat as we would be dining out later that evening.
This Burger King is in a very busy location and staff are working under pressure. It offers...More",TripAdvisor
112,2016-11-01,Not one of the better BK experienced I've had. Burger was sloppy and falling to bits. Didn't really taste very fresh. Very disappointed,TripAdvisor
113,2016-10-27,"At the end of the day, it's just a Burger King but it is in a good location making it unbelievably busy.  Handy to grab a quick bite to eat and a drink but nothing fancy.",TripAdvisor
114,2016-10-20,"Yes this specific branch is in Leicester Square and so is bound to be super busy but that shouldn't be an excuse for unprofessional behaviour. Not super clean either. However, the food is great! The burgers and fries have almost always been super fresh!",TripAdvisor
115,2016-10-12,"Arrived in Leicester square, genuinely couldnt see a mcdonalds, both starving so thought we would try burger king and it was lush! Had the crossaint burger breakfast thing - sausage , really nice . Asked for hashbrowns x2 got nugget type hash browns but thoroughly...More",TripAdvisor
116,2016-10-06,"Very Busy .Clean .A lot of Staff ,Which all Polite and very helpful .Food Served  very Quick and all food Hot ..A visit is a must ....If you are wanting some food Quick ....",TripAdvisor
117,2016-09-22,like all burger outlets go one day  great go another time of day rubbish we were lucky busy but got good service and with the meal deal free refills on drinks great for a quick eat at a good price,TripAdvisor
118,2016-09-21,Clean and not bad service. Love the drink choices. Disorganised queue to get served & expensive prices makes it a 3* out of 5*.,TripAdvisor
119,2016-09-19,it was totally rad dude ive never had a better experience man the chips were 45% salt (just how daddy likes it) and the uniforms were so in vogue they couldve been designed by a kardashian ive never been more impressed.,TripAdvisor
120,2016-09-17,"Leicester Square is good-nice staff, excellent setting, great views and food that matches the rest.

I handed in one of those vouchers you get in the papers (promising discounted deals) in the Lewisham High Street branch and saw the manger (a young Indian man) look...More",TripAdvisor
121,2016-09-15,"This is the most awful BK I have ever been too, service was embarrassingly slow, the staff were miserable and uniform was filthy. Their was a massive que and all the staff were too busy messing about. It is a fast food establishment So not...More",TripAdvisor
122,2016-09-07,"Alternative
We were looking  for MC
By mistake we felt it is closed
There fore  we  choose BK
It Is good fair enough
The kids enjoy it
Service 7.5 of 10
Food good
Staff nice",TripAdvisor
123,2016-08-24,Very slow service. Expensive. Very busy. Staff always attempt to up sell. As you expect from BK really.,TripAdvisor
124,2016-08-23,"I went in for a quick food run.   We walk everywhere and my body gets all messed up with the time change when we first get to Europe.    This was a late night food run.  

The crowds were insane.  I am talking more like a...More",TripAdvisor
125,2016-08-19,"Very busy and the service is slow for a fast food outlet. Ideal location in Leicester Square, long queues at the soft drinks dispenser",TripAdvisor
126,2016-08-04,"Great burger king with outside seating, ideal for people watching. This is great budget alternative or just for a cheap snack! Does all the standard Burger King options and not at inflated prices like other chains do. If your looking for posh burgers use one...More",TripAdvisor
127,2016-07-31,The queue was long but the service was friendly and once I ordered the food it came out promptly. Ample of sitting upstairs but the soda machines were flat and a lot of the flavors out. Convenient for feeding an American 13 year old that...More,TripAdvisor
128,2016-07-28,"Service was good but gosh, the burgers and breakfast not a whit better than in American BKs, which I avoid assiduously. Plenty of seating upstairs.  For cheap calories walk a block and a half east to Wok on the Walk.",TripAdvisor
129,2016-07-27,"Visited twice on a  recent rip to London as it was convenient. Never again though. Was in a queue to be served waiting for about 10 / 15 minutes, with one person in front of me also waiting to order, the lady behind the till...More",TripAdvisor
130,2016-07-25,"Don't usually go to Burger King, even though we live in Florida, but as a last resort we broke down and thought we would just try and see what they were like in England, What a mistake. The service was not too bad but the...More",TripAdvisor
131,2016-07-23,The service was poor staff unhelpful the food was cold and one off the juice machines down stairs was empty making the queue on the other one very long took about 10mins to get juice,TripAdvisor
132,2016-07-18,I'm a vegetarian and I went to Burger King with some friends. I didn't want to however they did so I went anyway. We went for lunch during the 20min we had free. I ordered one of the few veggie meals available. Now being veggie...More,TripAdvisor
133,2016-07-15,In a great location. Food is good and what you would expect. Really hate the drinks machine. Had a coca-cola it was flat and had a taste of the previous persons drink of Powerade! Yuck!,TripAdvisor
134,2016-07-12,Recommend getting the Burger King app to avoid spending London prices- one meal was £6+ but using the app we managed to get 2 chicken royale meals for £6.99- bargain! Meals were good not had a royale in years! Managed to get a seat which...More,TripAdvisor
135,2016-07-08,"Bad Employees, very slow service. Dirty place.  The queue was extensive after 15 minutes  just one e ad server.avoid and head to Mcdonalds just round the corner",TripAdvisor
136,2016-06-27,"What's not to love in this glass, round corner building? If you need a quick break during shopping to eat a burger and fries, get your proteins, you might enjoy Burger King Leicester Square. That's fast food, tasty but fat, you know exactly what you...More",TripAdvisor
137,2016-06-19,I was surprised to find it easy to get a seat downstairs looking out onto Leicester Square on a Friday evening.  We just needed some fast food and certainly got that.  Most people will have their favourite BK burgers and there's little to judge between...More,TripAdvisor
138,2016-06-11,"Had nice experience in Burget King Leicester Square. Food was as good as  any other burger king, ambience was excellent. Will  visit again.",TripAdvisor
139,2016-06-10,"Perfect location on the way back to the hotel , late night snack needed and this place provided it, a burger and a wrap and very nice it was as well, not sure about the security on the door but I suppose that is big...More",TripAdvisor
140,2016-06-06,"I witnessed staff abuse an old man for taking shelter in the shade on a hot day and another employee with a mop, continually hit my chair inside the restaurant when trying to eat their products.
The old man stuck up for himself which I...More",TripAdvisor
141,2016-05-14,"Popped in for a quick bit same as any other Burger King 
Clean and food served quick but very busy lots of tourists",TripAdvisor
142,2016-05-14,"Whilst not 5 star dining, great for a quick snack before a show or something afterwards.
Used the free wifi - but this is very unreliable - so don't rely upon it.
Suggest you be realistic here as always very busy.",TripAdvisor
143,2016-04-11,Came here for Lunch AND FOUND IT WAS BUSY-Yet no tables to sit down EXCEPT Kids on their phones using the free WIFI-no food or drinks!!!! Should not be allowed unless eating!! Taking up Tables. We found the CHIPS were cold and had to take...More,TripAdvisor
144,2016-04-10,Got to love Burger King and great place to get quick fast food. Place ain't to big and is always busy and you may have to wait a little bit to get your food or to be served that's because of the location. Patience is...More,TripAdvisor
145,2016-04-07,"Very quick service, even when busy. Friendly staff. Food was freshly cooked and hot! Delish.. Defo return for fast food",TripAdvisor
146,2016-03-31,local off shoot of the chain provides the same menu in a convenient location.ok for fast cheap eats..near mant movie theaters ..great for kids,TripAdvisor
147,2016-03-15,"Usual fast food place, service was friend and fast. Does get busy but plenty of seating available. Choice of soft drinks various flavours of coke etc not just the usual regular and diet.",TripAdvisor
148,2016-02-20,"I went to the burger located in Leicester Square last Thursday (18.02) night, about 11pm. My purse was stolen while I was eating and when the police went to check the security cameras in the place some were not even working!!!!! As the staff said,...More",TripAdvisor
149,2016-02-17,Good place to be for a cheap meal and if you do not like signing up to get free wifi. Only have to agree to T&C,TripAdvisor
150,2016-02-05,"Tasty food, quick service. Great place to pop in for a quick meal before carrying on sight seeing. Great choice on menu, loved the orange coke.",TripAdvisor
151,2016-01-20,It's was a Saturday & very busy as its the Festival of Lights in London. It is still clean & staff manage to cope with the customers. The toilet is clean & staff are so efficient.,TripAdvisor
152,2016-01-10,Burger King Leicester Square is for me a highlight of central London no Leicester Square visit is complete without a visit to the best fast food restaurant in central London. A very great alternative to the overpriced restaurants dotted around the Square. A must visit...More,TripAdvisor
153,2016-01-05,"I went with my gf to this Burger King, I liked the food but £6 is a lot for a fast food meal. The service was incredibly slow as it was a busy place to be in plus lot of people around the world eat...More",TripAdvisor
154,2015-12-31,"Like any other fast food around the world, what make this different to the others is the central position being located in one of the most famous squares in the world, Leicester Square, all in all or you come here to eat fast food or...More",TripAdvisor
155,2015-12-21,"We had the misfortune of going to this restaurant today 21/12/15.
I placed the order for the 5 of us which came to £35.37, put in my card and pin to be abruptly told the transaction had not gone through although I knew it had!...More",TripAdvisor
156,2015-12-17,"I have heard Burger King plans to solely and exclusively sell halal meat from now on? How does everyone feel about this? Their burgers are without doubt better than McD's, but have serious reservations as to how halal meat is slaughtered! Why should I be...More",TripAdvisor
157,2015-12-15,"Change of a river and a full belly, worth the long wait for the food to be served. Nice view from upstairs",TripAdvisor
158,2015-12-12,"everyone knows what they are getting from this burger chain, the issue for me was the service at the till from people who are on auto pilot , they will take money there is no need to do it well , type attitude. Placed our...More",TripAdvisor
159,2015-12-04,"If you just want a quick lunch at reasonable prices,  this burger king will fit the bill nicely. It has fast service good food, and we've seldom experienced anything derogatory here. However, if you have this place on your list of choices, it also means...More",TripAdvisor
160,2015-10-10,"I have come here few time when I am in London. Just a 1 min walk from Leicester square underground station. I ordered Chicken royale burger, chips and diet coke.
The food was ok warm. I sat by the window over looking Leicester Square were...More",TripAdvisor
161,2015-09-28,Despite the busy location we were served very quickly however the group behind ordered 20 meals leaving them as the priority. The staff panicked and their standards dropped. The quality of the food was excellent however. The toilets were very poorly maintained and smelt badly,TripAdvisor
162,2015-09-28,Situated in a busy part of London this is perfectly situated in Leicester square. Food is ok and staff efficient. Good for a quick bite to eat.,TripAdvisor
163,2015-09-10,Poor service very disappointed bad customers crevice very bad I must say  some of the staff don't even know what they sell not helpful at all even I try to help and become worst won't go back to this one in particularly,TripAdvisor
164,2015-09-01,"They were quite busy however waited (in the wrong queue) for over 10 mins just to get served, the waitress who served us seemed to know how to do everything just slowly!! Chips were lukewarm burger was average. you have to fill your own cup...More",TripAdvisor
165,2015-08-29,Good burgers but a very busy place due to its central location and difficult at times to find seats to sit down. Normal service.,TripAdvisor
166,2015-08-26,"Tasty cheese whoppers,if you are after fast food,but their normal burgers are too dry,and their filet of fish tasteless,(stick to Mcdonald's file-of fish).",TripAdvisor
167,2015-08-24,"Not our first choice of eatery, but it was pouring down with rain, so decided to go for it. Food was ok (for the expected fast food rubbish) Tables upsatirs were a bit grubby, but not as bad as the toilets. My son needed a...More",TripAdvisor
168,2015-08-10,"Came here about 8 year ago when I was drunk in Leicester square. Didn't want a burger, all I wanted was a plate full of gherkins. The staff said although I couldn't have a plate of gherkins I could buy ten burgers and take the...More",TripAdvisor
169,2015-08-07,"Not my choice to come here but the food was acceptable. 
I can imagine this place becoming horribly busy at weekends
It would have helped if the staff had better command of English.
It's a busy central Burger King so you basically know what to...More",TripAdvisor
170,2015-08-01,I went here to have dinner. Staff was not friendly at all. Food was okay. Toilets were very dirty. I wouldn't recommend going there.,TripAdvisor
171,2015-07-29,"I don't really know why I'm writing a review for this, I mean you know what you're getting when you go to a Burger King.

The food was fine.
The service was terse, but fine.

That's literally it.",TripAdvisor
172,2015-07-24,"Everything here was fine except for the drink vending machine that had some flavours unavailable. Furthermore, topping up the machine with ice took some time for the staff and he used a customer chair the stand on it which im sure is so dirty and...More",TripAdvisor
173,2015-07-24,"Due to it being in a busy part of London, service isn't that fast and you can expect a wait for your food, however, it's almost worth it for the coca cola freestyle machine offering bottomless drinks so you can try every flavour of sprite,...More",TripAdvisor
174,2015-07-21,"Have been here 3 times and had the same thing, XL bacon double cheese burger and fries. Satisfactory, what more can you say about Burger King?",TripAdvisor
175,2015-07-18,burger king is a branch just like mcdonalds but I prefer mcdonalds but you know its ok . okay service okay atmosphere its jus ok and don't forget to find me on instagram with @just_cutes,TripAdvisor
176,2015-06-18,"I came over here I ordered Pina coloada smoothie, Chicken royale and small fries.
I ask for takeway. I paid the money and the staff say next customer I was push off. The staff could have said its would take couples of mins stand here...More",TripAdvisor
177,2015-06-12,To be fair I felt sorry for the staff who didn't stop for a minute. Chicken sandwich was disgusting. Wouldn't go again,TripAdvisor
178,2015-06-04,"Having ate at Burger King all over England, we found this paricular place to be dirty, with poor service, we sat down, the table was sticky & the window was filthy, considering the site at Leicester Square, the management/owners really need to pull their finger...More",TripAdvisor
179,2015-05-29,Went for breakfast. Eventually had to shout into the kitchen to get staff to come and serve. Ordered bacon role no sauce. After a long time got told still waiting for the hash brown. Said I will have it without. Got bacon role covered in...More,TripAdvisor
180,2015-05-26,Great location! Right across from M&M World near Piccadilly Circus. Two floors and a lot of people. Nice and friendly staff and customers as well. Great place.,TripAdvisor
181,2015-04-21,"I was making my way to the tune station after a day of sight seeing and as i was going to eat later with friends i only wanted something ""lite"" so I chose to visit this place partly because it was raining outside and cold....More",TripAdvisor
182,2015-04-11,I was looking for somewhere to get a quick meal in Leicester Square and decided to pop in . Very surprised with the good service and how quick the food came . I just had a whopper burger and it was brilliant,TripAdvisor
183,2015-04-07,"Everything about the place is poor...... not enough people serving, so early on in the morning, having to wait, is just to poor..... my food, was over cooked, and my chips were cold, just everything fast food shouldn't be...
If you are thinking of going...More",TripAdvisor
184,2015-04-07,"Daddy could not change our sons nappy as no facility for Dads. The facility for a female to do this is on the 1st floor so you can not take your pram with you, so have to leave it potentially un attended......
The cubicle is...More",TripAdvisor
185,2015-03-23,"The staff here are disgusting, I had a burger here and then when I wen to go to the toilet the 'bouncer' security man was absolutely disgusting! He would not let me up to the toilet without providing a receipt and telling me I have...More",TripAdvisor
186,2015-03-03,burga king was the cream. luved dem oignon wings. my fave was da skin on da chicken. supa crispie. i like had me a melksake was da sickest thing i evr had. 10/10 would defo eat agin. not at dis place tho.,TripAdvisor
187,2015-02-25,"I came here fews times now. The lady took my order I had bacon double cheese burger and small coke. I was suprise the lady ask me to wait one side she taken 4 others people orders as well.
She give a empty cup you...More",TripAdvisor
188,2015-02-19,Where to start?! Firstly my order was wrong....I ordered plain but it came covered in lettuce and mayo....then there was only diet drinks in the self service machines....to top that ofc there was a homeless chinese guy who looked like he had a major mental...More,TripAdvisor
189,2015-02-03,"I've always wondered why Burger Kings aren't as popular as McDonald's and the answer is they are not as clean, the service is slower, the ambiance is dowdy and the food is just not as good. Bring back Mushroom double Swiss.",TripAdvisor
190,2015-02-01,"It was quite busy at the tills, but the food came relatively quickly. Food was exactly as you would expect, fair price, hot, well cooked.

The only fly in the ointment, the tomatoes in the Burgers was quite bitter and tough, and there was no...More",TripAdvisor
191,2015-01-25,"Very poor attitude from the staff when I visited, despite getting my order wrong 3 times and waiting 30 minutes for food , I got no apology! Toilets were disgusting and the whole place was very dirty.
Avoid and head to Mcdonalds just up the...More",TripAdvisor
192,2015-01-20,"Very busy but very nice, we went here for quickness and cheapness, prices are similar to that of back home, except food quality was much better, highlight was the raspberry coke!
good if you want something cheaper than restaurants",TripAdvisor
193,2015-01-07,"I have used this BK outlet a few times.  On my latest visit the upstairs was completely closed off, so no toilets and hardly anywhere to sit.  My experience at the counter was the usual having to repeat myself and answering questions about stuff I...More",TripAdvisor
194,2015-01-02,Do not visit this burger king ! Use your money wisely and visit an alternative. We went there and there were aound 10 people in store and still it took about 20 minutes for our cold food to arive. The staff were arguing at the...More,TripAdvisor
195,2014-12-30,"The queue was extensive. The server was difficult to communicate with, did not order what I wanted despite a request to read it back to me. She also stated all drinks were self service which was not the case. 

The server then did not ask...More",TripAdvisor
196,2014-12-13,"Went here at the insistance of a friend...awful is the only word to use

Rubbish everywhere
Bins overflowing
No working toilet
Disorganised queuing system
Staff giving customers each others food
No seats free...but no worry as the staff are still merrily dishing out eat in...More",TripAdvisor
197,2014-12-09,"same as any other burger king, staff were prompt serving and queues went down fairly quickly but - as to be expected from the location- there were few tables.",TripAdvisor
198,2014-12-08,We arrived at 2.00pm on Saturday and it was quite busy. Got served in about ten minutes but took that long for them to understand what I wanted. They could speak or understand very little English. The place felt and looked dirty. Ten minutes later...More,TripAdvisor
199,2014-12-07,"Quite busy took about 15 minutes to be served. Hardly any staff could speak or even understand English, had to point or say a number to order the food.Then waited another 10 minutes for the order.
Went upstairs found a seat, and to no surprise,...More",TripAdvisor
200,2014-12-06,Very disappointing.  The Whopper burger was dry. We were told they had no mayo or salt but saw the salt on our way out. I think the staff member who served us just couldn't be bothered to explain.  Toilets were all closed even though soft...More,TripAdvisor
201,2014-11-28,When you buy a big meal and more.. You dont go to your guest and tell them to throw a cola i havent drink up from a cinema that get caneled.  Dont be rude to people that eat here many times! The wifi dont work...More,TripAdvisor
202,2014-11-24,"I love my cheese burger and in the 60s and 70s always went to the Wimpy Bar in the East End of London. Last weekend I went to the theatre and fancied a cheese burger, Burger King was nearby so that is where I ordered...More",TripAdvisor
203,2014-11-24,"This place is very busy. The staff aren't the quickest. Food wise is to be expected. It is always clean, but be prepared to wait.",TripAdvisor
204,2014-10-27,"A big burger joint in Leicester Square.  They got our order wrong which was sorted out.
It is what it is clean and functional.",TripAdvisor
